22:14:44.220484 ARP, Request who-has 10.229.100.83 tell BaseMachine, length 28
22:14:44.221134 ARP, Reply 10.229.100.83 is-at 08:00:27:c8:52:d1 (oui Unknown), length 46
22:14:44.230940 ARP, Request who-has 10.229.100.29 tell BaseMachine, length 28
22:14:44.231505 ARP, Reply 10.229.100.29 is-at 08:00:27:39:ca:bb (oui Unknown), length 46
22:14:45.243163 ARP, Reply 10.229.100.29 is-at 08:00:27:87:e8:2f (oui Unknown), length 28
22:14:45.243177 ARP, Reply 10.229.100.83 is-at 08:00:27:87:e8:2f (oui Unknown), length 28
22:14:46.253450 ARP, Reply 10.229.100.29 is-at 08:00:27:87:e8:2f (oui Unknown), length 28
22:14:46.253496 ARP, Reply 10.229.100.83 is-at 08:00:27:87:e8:2f (oui Unknown), length 28
22:14:47.263702 ARP, Reply 10.229.100.29 is-at 08:00:27:87:e8:2f (oui Unknown), length 28
22:14:47.263741 ARP, Reply 10.229.100.83 is-at 08:00:27:87:e8:2f (oui Unknown), length 28
22:14:48.273918 ARP, Reply 10.229.100.29 is-at 08:00:27:87:e8:2f (oui Unknown), length 28
22:14:48.273949 ARP, Reply 10.229.100.83 is-at 08:00:27:87:e8:2f (oui Unknown), length 28
22:14:49.284204 ARP, Reply 10.229.100.29 is-at 08:00:27:87:e8:2f (oui Unknown), length 28
22:14:49.284290 ARP, Reply 10.229.100.83 is-at 08:00:27:87:e8:2f (oui Unknown), length 28
22:14:59.294494 ARP, Reply 10.229.100.29 is-at 08:00:27:87:e8:2f (oui Unknown), length 28
22:14:59.294535 ARP, Reply 10.229.100.83 is-at 08:00:27:87:e8:2f (oui Unknown), length 28
22:15:09.304735 ARP, Reply 10.229.100.29 is-at 08:00:27:87:e8:2f (oui Unknown), length 28
22:15:09.304768 ARP, Reply 10.229.100.83 is-at 08:00:27:87:e8:2f (oui Unknown), length 28
22:15:19.314928 ARP, Reply 10.229.100.29 is-at 08:00:27:87:e8:2f (oui Unknown), length 28
22:15:19.314957 ARP, Reply 10.229.100.83 is-at 08:00:27:87:e8:2f (oui Unknown), length 28
22:15:29.325117 ARP, Reply 10.229.100.29 is-at 08:00:27:87:e8:2f (oui Unknown), length 28
22:15:29.325149 ARP, Reply 10.229.100.83 is-at 08:00:27:87:e8:2f (oui Unknown), length 28
22:15:39.335280 ARP, Reply 10.229.100.29 is-at 08:00:27:87:e8:2f (oui Unknown), length 28
22:15:39.335305 ARP, Reply 10.229.100.83 is-at 08:00:27:87:e8:2f (oui Unknown), length 28
22:15:49.345528 ARP, Reply 10.229.100.29 is-at 08:00:27:87:e8:2f (oui Unknown), length 28
22:15:49.345553 ARP, Reply 10.229.100.83 is-at 08:00:27:87:e8:2f (oui Unknown), length 28
22:15:59.355700 ARP, Reply 10.229.100.29 is-at 08:00:27:87:e8:2f (oui Unknown), length 28
22:15:59.355724 ARP, Reply 10.229.100.83 is-at 08:00:27:87:e8:2f (oui Unknown), length 28
22:16:05.374770 ARP, Request who-has 10.229.100.29 tell BaseMachine, length 28
22:16:05.374859 ARP, Request who-has 10.229.100.83 tell BaseMachine, length 28
22:16:05.375380 ARP, Reply 10.229.100.83 is-at 08:00:27:c8:52:d1 (oui Unknown), length 46
22:16:05.375381 ARP, Reply 10.229.100.29 is-at 08:00:27:39:ca:bb (oui Unknown), length 46
22:16:09.365891 ARP, Reply 10.229.100.29 is-at 08:00:27:87:e8:2f (oui Unknown), length 28
22:16:09.365919 ARP, Reply 10.229.100.83 is-at 08:00:27:87:e8:2f (oui Unknown), length 28
22:16:19.376083 ARP, Reply 10.229.100.29 is-at 08:00:27:87:e8:2f (oui Unknown), length 28
22:16:19.376121 ARP, Reply 10.229.100.83 is-at 08:00:27:87:e8:2f (oui Unknown), length 28
22:16:29.386282 ARP, Reply 10.229.100.29 is-at 08:00:27:87:e8:2f (oui Unknown), length 28
22:16:29.386319 ARP, Reply 10.229.100.83 is-at 08:00:27:87:e8:2f (oui Unknown), length 28
22:16:39.396534 ARP, Reply 10.229.100.29 is-at 08:00:27:87:e8:2f (oui Unknown), length 28
22:16:39.396573 ARP, Reply 10.229.100.83 is-at 08:00:27:87:e8:2f (oui Unknown), length 28
22:16:49.407119 ARP, Reply 10.229.100.29 is-at 08:00:27:87:e8:2f (oui Unknown), length 28
22:16:49.407141 ARP, Reply 10.229.100.83 is-at 08:00:27:87:e8:2f (oui Unknown), length 28
22:16:59.417266 ARP, Reply 10.229.100.29 is-at 08:00:27:87:e8:2f (oui Unknown), length 28
22:16:59.417289 ARP, Reply 10.229.100.83 is-at 08:00:27:87:e8:2f (oui Unknown), length 28
22:17:05.790718 ARP, Request who-has 10.229.100.29 tell BaseMachine, length 28
22:17:05.790737 ARP, Request who-has 10.229.100.83 tell BaseMachine, length 28
22:17:05.791207 ARP, Reply 10.229.100.83 is-at 08:00:27:c8:52:d1 (oui Unknown), length 46
22:17:05.791423 ARP, Reply 10.229.100.29 is-at 08:00:27:39:ca:bb (oui Unknown), length 46
22:17:09.427457 ARP, Reply 10.229.100.29 is-at 08:00:27:87:e8:2f (oui Unknown), length 28
22:17:09.427483 ARP, Reply 10.229.100.83 is-at 08:00:27:87:e8:2f (oui Unknown), length 28
22:17:19.437657 ARP, Reply 10.229.100.29 is-at 08:00:27:87:e8:2f (oui Unknown), length 28
22:17:19.437688 ARP, Reply 10.229.100.83 is-at 08:00:27:87:e8:2f (oui Unknown), length 28
22:17:29.447821 ARP, Reply 10.229.100.29 is-at 08:00:27:87:e8:2f (oui Unknown), length 28
22:17:29.447846 ARP, Reply 10.229.100.83 is-at 08:00:27:87:e8:2f (oui Unknown), length 28
22:17:39.458031 ARP, Reply 10.229.100.29 is-at 08:00:27:87:e8:2f (oui Unknown), length 28
22:17:39.458059 ARP, Reply 10.229.100.83 is-at 08:00:27:87:e8:2f (oui Unknown), length 28
22:17:49.468204 ARP, Reply 10.229.100.29 is-at 08:00:27:87:e8:2f (oui Unknown), length 28
22:17:49.468227 ARP, Reply 10.229.100.83 is-at 08:00:27:87:e8:2f (oui Unknown), length 28
22:17:59.478470 ARP, Reply 10.229.100.29 is-at 08:00:27:87:e8:2f (oui Unknown), length 28
22:17:59.478523 ARP, Reply 10.229.100.83 is-at 08:00:27:87:e8:2f (oui Unknown), length 28
22:18:05.694752 ARP, Request who-has 10.229.100.29 tell BaseMachine, length 28
22:18:05.694775 ARP, Request who-has 10.229.100.83 tell BaseMachine, length 28
22:18:05.695269 ARP, Reply 10.229.100.83 is-at 08:00:27:c8:52:d1 (oui Unknown), length 46
22:18:05.695269 ARP, Reply 10.229.100.29 is-at 08:00:27:39:ca:bb (oui Unknown), length 46
22:18:09.488908 ARP, Reply 10.229.100.29 is-at 08:00:27:87:e8:2f (oui Unknown), length 28
22:18:09.488958 ARP, Reply 10.229.100.83 is-at 08:00:27:87:e8:2f (oui Unknown), length 28
22:18:19.499641 ARP, Reply 10.229.100.29 is-at 08:00:27:87:e8:2f (oui Unknown), length 28
22:18:19.499662 ARP, Reply 10.229.100.83 is-at 08:00:27:87:e8:2f (oui Unknown), length 28
22:18:29.509842 ARP, Reply 10.229.100.29 is-at 08:00:27:87:e8:2f (oui Unknown), length 28
22:18:29.509873 ARP, Reply 10.229.100.83 is-at 08:00:27:87:e8:2f (oui Unknown), length 28
22:18:39.520024 ARP, Reply 10.229.100.29 is-at 08:00:27:87:e8:2f (oui Unknown), length 28
22:18:39.520050 ARP, Reply 10.229.100.83 is-at 08:00:27:87:e8:2f (oui Unknown), length 28
22:18:49.530214 ARP, Reply 10.229.100.29 is-at 08:00:27:87:e8:2f (oui Unknown), length 28
22:18:49.530240 ARP, Reply 10.229.100.83 is-at 08:00:27:87:e8:2f (oui Unknown), length 28
22:18:59.540367 ARP, Reply 10.229.100.29 is-at 08:00:27:87:e8:2f (oui Unknown), length 28
22:18:59.540397 ARP, Reply 10.229.100.83 is-at 08:00:27:87:e8:2f (oui Unknown), length 28
22:19:05.598709 ARP, Request who-has 10.229.100.29 tell BaseMachine, length 28
22:19:05.598729 ARP, Request who-has 10.229.100.83 tell BaseMachine, length 28
22:19:05.599141 ARP, Reply 10.229.100.29 is-at 08:00:27:39:ca:bb (oui Unknown), length 46
22:19:05.599294 ARP, Reply 10.229.100.83 is-at 08:00:27:c8:52:d1 (oui Unknown), length 46
22:19:09.550596 ARP, Reply 10.229.100.29 is-at 08:00:27:87:e8:2f (oui Unknown), length 28
22:19:09.550629 ARP, Reply 10.229.100.83 is-at 08:00:27:87:e8:2f (oui Unknown), length 28
22:19:19.561514 ARP, Reply 10.229.100.29 is-at 08:00:27:87:e8:2f (oui Unknown), length 28
22:19:19.561678 ARP, Reply 10.229.100.83 is-at 08:00:27:87:e8:2f (oui Unknown), length 28
22:19:29.572704 ARP, Reply 10.229.100.29 is-at 08:00:27:87:e8:2f (oui Unknown), length 28
22:19:29.572761 ARP, Reply 10.229.100.83 is-at 08:00:27:87:e8:2f (oui Unknown), length 28
22:19:39.583078 ARP, Reply 10.229.100.29 is-at 08:00:27:87:e8:2f (oui Unknown), length 28
22:19:39.583118 ARP, Reply 10.229.100.83 is-at 08:00:27:87:e8:2f (oui Unknown), length 28
22:19:49.593274 ARP, Reply 10.229.100.29 is-at 08:00:27:87:e8:2f (oui Unknown), length 28
22:19:49.593301 ARP, Reply 10.229.100.83 is-at 08:00:27:87:e8:2f (oui Unknown), length 28
22:19:59.603468 ARP, Reply 10.229.100.29 is-at 08:00:27:87:e8:2f (oui Unknown), length 28
22:19:59.603492 ARP, Reply 10.229.100.83 is-at 08:00:27:87:e8:2f (oui Unknown), length 28
22:20:05.502746 ARP, Request who-has 10.229.100.29 tell BaseMachine, length 28
22:20:05.502780 ARP, Request who-has 10.229.100.83 tell BaseMachine, length 28
22:20:05.503422 ARP, Reply 10.229.100.29 is-at 08:00:27:39:ca:bb (oui Unknown), length 46
22:20:05.503423 ARP, Reply 10.229.100.83 is-at 08:00:27:c8:52:d1 (oui Unknown), length 46
22:20:09.613596 ARP, Reply 10.229.100.29 is-at 08:00:27:87:e8:2f (oui Unknown), length 28
22:20:09.613621 ARP, Reply 10.229.100.83 is-at 08:00:27:87:e8:2f (oui Unknown), length 28
22:20:19.623861 ARP, Reply 10.229.100.29 is-at 08:00:27:87:e8:2f (oui Unknown), length 28
22:20:19.623921 ARP, Reply 10.229.100.83 is-at 08:00:27:87:e8:2f (oui Unknown), length 28
22:20:29.634006 ARP, Reply 10.229.100.29 is-at 08:00:27:87:e8:2f (oui Unknown), length 28
22:20:29.634031 ARP, Reply 10.229.100.83 is-at 08:00:27:87:e8:2f (oui Unknown), length 28
22:20:39.644182 ARP, Reply 10.229.100.29 is-at 08:00:27:87:e8:2f (oui Unknown), length 28
22:20:39.644234 ARP, Reply 10.229.100.83 is-at 08:00:27:87:e8:2f (oui Unknown), length 28
22:20:49.654326 ARP, Reply 10.229.100.29 is-at 08:00:27:87:e8:2f (oui Unknown), length 28
22:20:49.654351 ARP, Reply 10.229.100.83 is-at 08:00:27:87:e8:2f (oui Unknown), length 28
22:20:59.664488 ARP, Reply 10.229.100.29 is-at 08:00:27:87:e8:2f (oui Unknown), length 28
22:20:59.664522 ARP, Reply 10.229.100.83 is-at 08:00:27:87:e8:2f (oui Unknown), length 28
22:21:05.406708 ARP, Request who-has 10.229.100.29 tell BaseMachine, length 28
22:21:05.406732 ARP, Request who-has 10.229.100.83 tell BaseMachine, length 28
22:21:05.407287 ARP, Reply 10.229.100.29 is-at 08:00:27:39:ca:bb (oui Unknown), length 46
22:21:05.407288 ARP, Reply 10.229.100.83 is-at 08:00:27:c8:52:d1 (oui Unknown), length 46
22:21:09.674668 ARP, Reply 10.229.100.29 is-at 08:00:27:87:e8:2f (oui Unknown), length 28
22:21:09.674693 ARP, Reply 10.229.100.83 is-at 08:00:27:87:e8:2f (oui Unknown), length 28
22:21:19.684837 ARP, Reply 10.229.100.29 is-at 08:00:27:87:e8:2f (oui Unknown), length 28
22:21:19.684870 ARP, Reply 10.229.100.83 is-at 08:00:27:87:e8:2f (oui Unknown), length 28
22:21:29.694963 ARP, Reply 10.229.100.29 is-at 08:00:27:87:e8:2f (oui Unknown), length 28
22:21:29.694989 ARP, Reply 10.229.100.83 is-at 08:00:27:87:e8:2f (oui Unknown), length 28
22:21:39.705147 ARP, Reply 10.229.100.29 is-at 08:00:27:87:e8:2f (oui Unknown), length 28
22:21:39.705171 ARP, Reply 10.229.100.83 is-at 08:00:27:87:e8:2f (oui Unknown), length 28
22:21:49.715307 ARP, Reply 10.229.100.29 is-at 08:00:27:87:e8:2f (oui Unknown), length 28
22:21:49.715331 ARP, Reply 10.229.100.83 is-at 08:00:27:87:e8:2f (oui Unknown), length 28
22:21:59.725522 ARP, Reply 10.229.100.29 is-at 08:00:27:87:e8:2f (oui Unknown), length 28
22:21:59.725580 ARP, Reply 10.229.100.83 is-at 08:00:27:87:e8:2f (oui Unknown), length 28
22:22:05.310746 ARP, Request who-has 10.229.100.29 tell BaseMachine, length 28
22:22:05.310786 ARP, Request who-has 10.229.100.83 tell BaseMachine, length 28
22:22:05.311435 ARP, Reply 10.229.100.29 is-at 08:00:27:39:ca:bb (oui Unknown), length 46
22:22:05.311435 ARP, Reply 10.229.100.83 is-at 08:00:27:c8:52:d1 (oui Unknown), length 46
22:22:09.735704 ARP, Reply 10.229.100.29 is-at 08:00:27:87:e8:2f (oui Unknown), length 28
22:22:09.735737 ARP, Reply 10.229.100.83 is-at 08:00:27:87:e8:2f (oui Unknown), length 28
22:22:19.745877 ARP, Reply 10.229.100.29 is-at 08:00:27:87:e8:2f (oui Unknown), length 28
22:22:19.745901 ARP, Reply 10.229.100.83 is-at 08:00:27:87:e8:2f (oui Unknown), length 28
22:22:29.756048 ARP, Reply 10.229.100.29 is-at 08:00:27:87:e8:2f (oui Unknown), length 28
22:22:29.756080 ARP, Reply 10.229.100.83 is-at 08:00:27:87:e8:2f (oui Unknown), length 28
22:22:39.766262 ARP, Reply 10.229.100.29 is-at 08:00:27:87:e8:2f (oui Unknown), length 28
22:22:39.766302 ARP, Reply 10.229.100.83 is-at 08:00:27:87:e8:2f (oui Unknown), length 28
22:22:49.776463 ARP, Reply 10.229.100.29 is-at 08:00:27:87:e8:2f (oui Unknown), length 28
22:22:49.776487 ARP, Reply 10.229.100.83 is-at 08:00:27:87:e8:2f (oui Unknown), length 28
22:22:59.786631 ARP, Reply 10.229.100.29 is-at 08:00:27:87:e8:2f (oui Unknown), length 28
22:22:59.786662 ARP, Reply 10.229.100.83 is-at 08:00:27:87:e8:2f (oui Unknown), length 28
